Flag Name,Flag Subgroup,Flag Description,Selectable Options,Flag Value Type,Flag Default Value,Flag Checks,Error MessageSTG_MotherOfAllFolders,Paths,path on file system of the folder containing selected yml file,,str,not set yet,,STG_Datapath,Paths,"string pointing to a folder for raw data. Can be absolute or relative to STG_MotherOfAllFolders (by default, this is the folder containing the YML file)",,str,not set yet,,STG_Measu,Paths,measurement tag. Will be used to look up rows from LST files. Refers to the line with this value in column 'measu',,int,-1,,STG_OdorInfoPath,Paths,"string pointing to a folder for measurement list files. Can be absolute or relative to STG_MotherOfAllFolders (by default, this is the folder containing the YML file)",,str,not set yet,,STG_OdormaskPath,Paths,"string pointing to a folder for spatial footprint information of ROIs (primarily) and AREAs (as backup). Can be absolute or relative to STG_MotherOfAllFolders (by default, this is the folder containing the YML file)",,str,not set yet,,STG_OdorAreaPath,Paths,"string pointing to a folder for spatial footprint information of AREAs. Can be absolute or relative to STG_MotherOfAllFolders (by default, this is the folder containing the YML file)",,str,Areas,,STG_OdorReportFile,Paths,string for free usage to define output file name,,str,empty,,STG_OdorReportPath,Paths,"string pointing to a folder for output (movies, overviews, tapestries, glodatamixes, pipeline reports). Can be absolute or relative to STG_MotherOfAllFolders (by default, this is the folder containing the YML file)",,str,not set yet,,STG_ReportTag,Paths,name of this animal e.g. in animal.lst,,str,not set yet,,STG_ProcessedDataPath,Paths,"string pointing to a folder for processed data (movement corrected movies, etc). Can be absolute or relative to STG_MotherOfAllFolders (by default, this is the folder containing the YML file)",,str,Processed Data,,STG_TempArchivePath,Paths,string pointing to a folder which will be used to archive files generated for the comparison of pipelines. Must be absolute,,str,not set yet,,CTV_FeatureNumber,Output,"integer indicating which feature of the CTV to use, where CTV features are numbered 0, 1, 2, 3, ...",,int,0,{flag} >= 0,"Flag {flag_name} can only take integer values 0, 1, 2... Specified value: {flag}"CTV_firstframe,Output,"integer indicating a frame number, where frames are numbered 0, 1, 2...",,int,22,,CTV_lastframe,Output,"integer indicating a frame number, where frames are numbered 0, 1, 2...",,int,36,,CTV_Method,Output,"specifies curve-to-value function for pixelwise application to movies to generate overviews. To specify a custom-written ctv method, specify function name here and the file containing it in 'CTV_MethodFile'. Or use an internally implemented CTV","22: is the difference between two fixed points0: one feature, (definition taken forward from VIEW-IDL) mean of all frames, useful for simulated photographs22: one feature, (mean of 3 frames around <last_frame>) – (mean of 3 frames around <first_frame>)222: one feature, (mean of 4 frames starting at <last_frame>) – (mean of 4 frames starting at <first_frame>)35: one feature, relates to the maximum within 3 secs after stimulus onset22and35: two features, of 22 and 35 above300: one feature, same as 0301: one feature, (definition taken forward from VIEW-IDL) mean of frames 5 to 10, which is generally before stimulus onset. Useful for morphological views.302: one feature, mean of frames from <first_frame> to <last_frame> (both inclusive).303: one feature, Average of background frames, calculated using first stimulus onset and the flags LE_StartBackground and LE_PrestimEndBackground. Can be useful to visualize and compare baseline values of signals.330: one feature, median of all frames331: one feature, median of frames 5 to 10, which is generally before stimulus onset. Useful for morphological views.332: one feature, median of frames from <first_frame> to <last_frame> (both inclusive).333: one feature, Median of background frames, calculated using first stimulus onset and the flags LE_StartBackground and LE_PrestimEndBackground. Can be useful to visualize and compare baseline values of signals.","int, str",22,,CTV_MethodFile,Output,only used when 'CTV_Method',,str,not set yet,,CTV_scalebar,Output,"when True, colorbar is added to the right of overviews and movies",,bool,False,,CTV_StimulusNumber,Output,"integer indicating which stimulus to use when calculating CTV, where stimuli are numbered 0, 1, 2, 3, ...",,int,0,{flag} >= 0,"Flag {flag_name} can only take integer values 0, 1, 2... Specified value: {flag}"CTVM_Method,Output,(not yet implemented in pyVIEW)for multiple CTV values at once,,int,0,,Signal_FilterSpaceFlag,Output,Toggles on/off the filter applied to sig1 before generating overview frames or movies,,bool,0,,Signal_FilterSpaceSize,Output,standard deviation of the spatial gaussian filter applied to sig1 before creating overviews/movies. Only used if 'Signal_FilterSpaceFlag' is True,,float,3,,Signal_FilterTimeFlag,Output,Toggles on/off the filter applied to sig1 before generating movies,,bool,0,,Signal_FilterTimeSize,Output,standard deviation of the temporal gaussian filter applied to sig1 before creating movies. Only used if 'Signal_FilterTimeFlag' is True,,float,3,,RM_differentViews,Output,"Change view, e.g. mirror flip right ALs   (SingleOverviews.pro)",,bool,0,,RM_Radius,Output,"integer representing number of pixels, interpreted as the size of glomeruli read from .coor file, used when marking ROIs on overviews and exporting glodatamixes",,int,5,,RM_ROIThreshold,Output,"When converting spatial footprints of ROIs into binary masks, all pixel above this percentile will be considered to be inside the binary mask",,float,75,,RM_ROITrace,Output,Indicates the file from which component masks are sourced,"0 : read the .coor file1 : (not tested) read the .tif file (8-bit, value indicates the name of the glomerulus)2 : read the .Area file (IDL format).3 : read the .roi file created in ILTIS4 : read the .roi.tif file created by a processing pipeline5 : read the .area.tif file created in ILTIS6 : use a fictive ROI with uniform weight over the entire frame",int,3,,SO_MV_scalemax,Output,value to scale maximum to with SO_indivdiualScale or mv_individualScale equals 0,,float,1,,SO_MV_scalemin,Output,corresponding value for minimum,,float,0,,LE_CalcMethod,CalcSignals,integer indicating the method used for calculating a biologically relevant signal from raw movie data. Used in view/python_core/calc_methods.py,"0: sig1 = raw1 / 10001: sig1 = raw2 / 10003: sig1 = deltaF/F4: sig1 = raw1/raw2 - (raw1/raw2 averaged over the background)",int,3,,VIEW_batchmode,Xtra,"choice between interactive mode and VIEW_batchmode. Valid values are: True, False ",,bool,True,,SO_MV_colortable,Xtra,"if integer indicates an IDL_style color table to use. Valid values are: 11-14. Values are 12-14 self-programmed rainbows.if string, must be the name of a matplotlib colormap.See https://matplotlib.org/tutorials/colors/colormaps.html.NOTE: The inverse of every matplotlib colormap is also available, just append '_r' to colormap name. E.g.: Inverse of the colormap 'jet' would be 'jet_r'","11: a self programmed SO_MV_colortable12: a self-programmed rainbow SO_MV_colortable13: a self-programmed rainbow SO_MV_colortable14: a self-programmed rainbow SO_MV_colortablejet: a matplotlib colormapviridis: a matplotlib colormap, etc","int, str",13,,